{
  "$schema": "./schema.json",
  "year": 2022,
  "season": "Winter",
  "dateTime": "2022년 2월 26일(토) 오후 12시 ~ 오후 5시",
  "note": "",
  "links": {
    "problemBojLink": "https://www.acmicpc.net/category/detail/3032",
    "problemPdf": "SUAPC_2022w_Problem.pdf",
    "solutionPdf": "SUAPC_2022w_Solution.pdf",
    "scoreboard": ["https://www.acmicpc.net/contest/spotboard/764"],
    "posterImage": "SUAPC_2022w_Poster.jpg"
  },
  "contest": [
    {
      "contestName": null,
      "awards": [
        {
          "rank": 1,
          "solved": 7,
          "teamName": "5시간 집중하기 힘든 나이",
          "school": "서강대학교",
          "member": ["박재형", "오재석", "진상우"]
        },
        {
          "rank": 2,
          "solved": 7,
          "teamName": "서강베스트",
          "school": "서강대학교",
          "member": ["김동건", "이재혁", "조원빈"]
        },
        {
          "rank": 3,
          "solved": 7,
          "teamName": "정열맨",
          "school": "홍익대학교",
          "member": ["김도현", "김재헌", "정재현"]
        },
        {
          "rank": 4,
          "solved": 7,
          "teamName": "No Seastar Can't Win",
          "school": "서강대학교",
          "member": ["김정모", "김준우", "박준서"]
        },
        {
          "rank": 5,
          "solved": 7,
          "teamName": "ECM",
          "school": "서강대학교",
          "member": ["권지은", "김성현", "김창민"]
        },
        {
          "rank": 6,
          "solved": 7,
          "teamName": "BIROSO",
          "school": "서강대학교",
          "member": ["김예진", "김용현", "박민성"]
        },
        {
          "rank": 7,
          "solved": 7,
          "teamName": "어라랍스타",
          "school": "연세대학교",
          "member": ["김종민", "김태윤", "이승재"]
        },
        {
          "rank": 8,
          "solved": 7,
          "teamName": "하와이안 민트초코",
          "school": "연세대학교",
          "member": ["김건우", "유영서", "전재현"]
        },
        {
          "rank": 9,
          "solved": 7,
          "teamName": "so강은 so 강하다",
          "school": "서강대학교",
          "member": ["강효규", "김서인", "신동준"]
        },
        {
          "rank": 10,
          "solved": 7,
          "teamName": "홍입2출할리스20시알바따뜻한아아할줄알아요",
          "school": "연세대학교",
          "member": ["곽재혁", "이훈재", "임승원"]
        }
      ],
      "problemList": [
        {
          "problemTitle": "튜터-튜티 관계의 수",
          "link": "https://www.acmicpc.net/problem/24542",
          "setter": {
            "name": "박찬솔",
            "school": "숭실대학교",
            "bojHandle": "chansol"
          }
        },
        {
          "problemTitle": "선인장이 무럭무럭 자라고 있어요",
          "link": "https://www.acmicpc.net/problem/24543",
          "setter": {
            "name": "이국렬",
            "school": "연세대학교",
            "bojHandle": "lky7674"
          }
        },
        {
          "problemTitle": "카카오뷰 큐레이팅 효용성 분석",
          "link": "https://www.acmicpc.net/problem/24544",
          "setter": {
            "name": "홍은기",
            "school": "삼성전자",
            "bojHandle": "pichulia"
          }
        },
        {
          "problemTitle": "Y",
          "link": "https://www.acmicpc.net/problem/24545",
          "setter": {
            "name": "조찬우",
            "school": "선린인터넷고등학교",
            "bojHandle": "myyh1234"
          }
        },
        {
          "problemTitle": "놀이기구에 진심인 편",
          "link": "https://www.acmicpc.net/problem/24546",
          "setter": {
            "name": "이상원",
            "school": "삼성전자",
            "bojHandle": "gumgood"
          }
        },
        {
          "problemTitle": "mod와 쿼리",
          "link": "https://www.acmicpc.net/problem/24547",
          "setter": {
            "name": "김태영",
            "school": "KAIST",
            "bojHandle": "tae826"
          }
        },
        {
          "problemTitle": "도로 정보",
          "link": "https://www.acmicpc.net/problem/24548",
          "setter": {
            "name": "박진식",
            "school": "크리마",
            "bojHandle": "pjshwa"
          }
        },
        {
          "problemTitle": "신촌방위본부의 부대 배치",
          "link": "https://www.acmicpc.net/problem/24549",
          "setter": {
            "name": "이국렬",
            "school": "연세대학교",
            "bojHandle": "lky7674"
          }
        },
        {
          "problemTitle": "이 멋진 수열에 쿼리를!",
          "link": "https://www.acmicpc.net/problem/24550",
          "setter": {
            "name": "홍은기",
            "school": "삼성전자",
            "bojHandle": "pichulia"
          }
        },
        {
          "problemTitle": "일이 너무 많아...",
          "link": "https://www.acmicpc.net/problem/24551",
          "setter": {
            "name": "홍은기",
            "school": "삼성전자",
            "bojHandle": "pichulia"
          }
        },
        {
          "problemTitle": "올바른 괄호",
          "link": "https://www.acmicpc.net/problem/24552",
          "setter": {
            "name": "박찬솔",
            "school": "숭실대학교",
            "bojHandle": "chansol"
          }
        },
        {
          "problemTitle": "팰린드롬 게임",
          "link": "https://www.acmicpc.net/problem/24553",
          "setter": {
            "name": "김태영",
            "school": "KAIST",
            "bojHandle": "tae826"
          }
        },
        {
          "problemTitle": "불협화음",
          "link": "https://www.acmicpc.net/problem/24554",
          "setter": {
            "name": "홍은기",
            "school": "삼성전자",
            "bojHandle": "pichulia"
          }
        }
      ]
    }
  ],
  "setter": [
    {
      "name": "김태영",
      "school": "KAIST",
      "bojHandle": "tae826"
    },
    {
      "name": "박진식",
      "school": "크리마",
      "bojHandle": "pjshwa"
    },
    {
      "name": "박찬솔",
      "school": "숭실대학교",
      "bojHandle": "chansol"
    },
    {
      "name": "이국렬",
      "school": "연세대학교",
      "bojHandle": "lky7674"
    },
    {
      "name": "이상원",
      "school": "삼성전자",
      "bojHandle": "gumgood"
    },
    {
      "name": "조찬우",
      "school": "선린인터넷고등학교",
      "bojHandle": "myyh1234"
    },
    {
      "name": "홍은기",
      "school": "삼성전자",
      "bojHandle": "pichulia"
    }
  ],
  "reviewer": [
    {
      "name": "김동규",
      "school": "KAIST AI대학원",
      "bojHandle": "eaststar"
    },
    {
      "name": "강희원",
      "school": "경기북과학고등학교",
      "bojHandle": "heeda0528"
    },
    {
      "name": "남현욱",
      "school": "Team Samoyed",
      "bojHandle": "jwvg0425"
    },
    {
      "name": "서태수",
      "school": "삼성전자",
      "bojHandle": "cheetose"
    },
    {
      "name": "최재민",
      "school": "KAIST",
      "bojHandle": "jh05013"
    }
  ],
  "sponsor": [
    {
      "id": "kakao",
      "name": "카카오"
    },
    {
      "id": "autoever",
      "name": "현대오토에버"
    },
    {
      "id": "hello-algo",
      "name": "헬로알고"
    },
    {
      "id": "naver-d2",
      "name": "네이버 D2"
    },
    {
      "id": "secmem",
      "name": "삼성소프트웨어멤버십"
    },
    {
      "id": "jetbrains",
      "name": "JetBrains"
    },
    {
      "id": "youngjin",
      "name": "영진닷컴"
    },
    {
      "id": "easyspub",
      "name": "이지스퍼블리싱"
    },
    {
      "id": "hanbit",
      "name": "한빛미디어"
    },
    {
      "id": "startlink",
      "name": "스타트링크"
    }
  ]
}
