{
  "$schema": "./schema.json",
  "year": 2023,
  "season": "Summer",
  "dateTime": "2023년 8월 26일(토) 오후 12시 ~ 오후 5시",
  "note": "",
  "links": {
    "problemBojLink": "https://www.acmicpc.net/category/detail/3855",
    "solutionPdf": "SUAPC_2023_Summer_Solution.pdf",
    "scoreboard": ["https://www.acmicpc.net/contest/spotboard/1104"],
    "posterImage": "SUAPC_2023s_Poster.jpeg"
  },
  "contest": [
    {
      "contestName": null,
      "awards": [
        {
          "rank": 1,
          "solved": 12,
          "teamName": "Redshift",
          "school": "서강대학교",
          "member": ["박수현", "이준석", "채성우"]
        },
        {
          "rank": 2,
          "solved": 11,
          "teamName": "SCC_Sinchon Coding Champions",
          "school": "연세대학교",
          "member": ["김태윤", "정용진", "김건우"]
        },
        {
          "rank": 3,
          "solved": 11,
          "teamName": "월파출신 코치가 가르치고 있어요",
          "school": "서강대학교",
          "member": ["송근수", "이승형", "박성준"]
        },
        {
          "rank": 4,
          "solved": 10,
          "teamName": "가오당",
          "school": "연세대학교",
          "member": ["한의엽", "전우제", "이지언"]
        },
        {
          "rank": 5,
          "solved": 9,
          "teamName": "1등하러왔습니다",
          "school": "연세대학교",
          "member": ["곽재혁", "김형진", "박경욱"]
        },
        {
          "rank": 6,
          "solved": 9,
          "teamName": "병공병",
          "school": "홍익대학교",
          "member": ["정재현", "김도현", "김재헌"]
        },
        {
          "rank": 7,
          "solved": 9,
          "teamName": "조성훈",
          "school": "서강대학교",
          "member": ["조성훈", "조원빈", "김동건"]
        },
        {
          "rank": 8,
          "solved": 8,
          "teamName": "기령손의 그녀들",
          "school": "서강대학교",
          "member": ["강효규", "김서인", "장유빈"]
        },
        {
          "rank": 9,
          "solved": 7,
          "teamName": "WooJeans",
          "school": "서강대학교",
          "member": ["이우진", "정회윤", "유호영"]
        },
        {
          "rank": 10,
          "solved": 6,
          "teamName": "홍하예프",
          "school": "홍익대학교",
          "member": ["한승준", "전승민", "심동현"]
        }
      ],
      "problemList": [
        {
          "problemTitle": "A→B",
          "link": "https://www.acmicpc.net/problem/29149",
          "setter": {
            "name": "이도훈",
            "school": "연세대학교",
            "bojHandle": "dhlee1031"
          }
        },
        {
          "problemTitle": "기초적인 문제",
          "link": "https://www.acmicpc.net/problem/29150",
          "setter": {
            "name": "이명헌",
            "school": "연세대학교",
            "bojHandle": "nflight11"
          }
        },
        {
          "problemTitle": "2048",
          "link": "https://www.acmicpc.net/problem/29151",
          "setter": {
            "name": "최우현",
            "school": "연세대학교",
            "bojHandle": "starwh03"
          }
        },
        {
          "problemTitle": "디지털 트윈",
          "link": "https://www.acmicpc.net/problem/29152",
          "setter": {
            "name": "이협",
            "school": "연세대학교",
            "bojHandle": "dlguq0107"
          }
        },
        {
          "problemTitle": "성게밭",
          "link": "https://www.acmicpc.net/problem/29153",
          "setter": {
            "name": "이협",
            "school": "연세대학교",
            "bojHandle": "dlguq0107"
          }
        },
        {
          "problemTitle": "작곡가 A의 시창 평가",
          "link": "https://www.acmicpc.net/problem/29154",
          "setter": {
            "name": "길수민",
            "school": "숙명여자대학교",
            "bojHandle": "2093ab"
          }
        },
        {
          "problemTitle": "개발자 지망생 구름이의 취업 뽀개기",
          "link": "https://www.acmicpc.net/problem/29155",
          "setter": {
            "name": "길수민",
            "school": "숙명여자대학교",
            "bojHandle": "2093ab"
          }
        },
        {
          "problemTitle": "탭 UI",
          "link": "https://www.acmicpc.net/problem/29156",
          "setter": {
            "name": "신정환",
            "school": "성균관대학교",
            "bojHandle": "shjohw12"
          }
        },
        {
          "problemTitle": "폭탄 피하기",
          "link": "https://www.acmicpc.net/problem/29157",
          "setter": {
            "name": "이지훈",
            "school": "서강대학교",
            "bojHandle": "maker29"
          }
        },
        {
          "problemTitle": "큰 수 만들기 게임",
          "link": "https://www.acmicpc.net/problem/29158",
          "setter": {
            "name": "이지훈",
            "school": "서강대학교",
            "bojHandle": "maker29"
          }
        },
        {
          "problemTitle": "케이크 두 개",
          "link": "https://www.acmicpc.net/problem/29159",
          "setter": {
            "name": "이명헌",
            "school": "연세대학교",
            "bojHandle": "nflight11"
          }
        },
        {
          "problemTitle": "나의 FIFA 팀 가치는?",
          "link": "https://www.acmicpc.net/problem/29160",
          "setter": {
            "name": "이지훈",
            "school": "서강대학교",
            "bojHandle": "maker29"
          }
        },
        {
          "problemTitle": "트리와 케이",
          "link": "https://www.acmicpc.net/problem/29161",
          "setter": {
            "name": "최우현",
            "school": "연세대학교",
            "bojHandle": "starwh03"
          }
        },
        {
          "problemTitle": "북극여우는 괄호를 뒤집어",
          "link": "https://www.acmicpc.net/problem/29162",
          "setter": {
            "name": "이협",
            "school": "연세대학교",
            "bojHandle": "dlguq0107"
          }
        }
      ]
    }
  ],
  "setter": [
    {
      "name": "길수민",
      "school": "숙명여자대학교",
      "bojHandle": "2093ab"
    },
    {
      "name": "신정환",
      "school": "성균관대학교",
      "bojHandle": "shjohw12"
    },
    {
      "name": "이도훈",
      "school": "연세대학교",
      "bojHandle": "dhlee1031"
    },
    {
      "name": "이명헌",
      "school": "연세대학교",
      "bojHandle": "nflight11"
    },
    {
      "name": "이지훈",
      "school": "서강대학교",
      "bojHandle": "maker29"
    },
    {
      "name": "이협",
      "school": "연세대학교",
      "bojHandle": "dlguq0107"
    },
    {
      "name": "최우현",
      "school": "연세대학교",
      "bojHandle": "starwh03"
    }
  ],
  "reviewer": [
    {
      "name": "김영현",
      "school": "서울대학교",
      "bojHandle": "kipa00"
    },
    {
      "name": "박찬솔",
      "school": "숭실대학교",
      "bojHandle": "chansol"
    },
    {
      "name": "심유근",
      "school": "서울대학교",
      "bojHandle": "cozyyg"
    },
    {
      "name": "이국렬",
      "school": "연세대학교",
      "bojHandle": "lky7674"
    },
    {
      "name": "cologne",
      "school": "(비공개)",
      "bojHandle": "cologne"
    }
  ],
  "sponsor": [
    {
      "id": "autoever",
      "name": "현대오토에버"
    },
    {
      "id": "nexon",
      "name": "넥슨"
    },
    {
      "id": "hanbit",
      "name": "한빛미디어"
    },
    {
      "id": "easyspub",
      "name": "이지스퍼블리싱"
    },
    {
      "id": "goorm",
      "name": "구름"
    },
    {
      "id": "startlink",
      "name": "스타트링크"
    },
    {
      "id": "moloco",
      "name": "몰로코"
    },
    {
      "id": "jpub",
      "name": "제이펍"
    },
    {
      "id": "solvedac",
      "name": "솔브드"
    }
  ]
}
