{
  "$schema": "./schema.json",
  "year": 2021,
  "season": "Winter",
  "dateTime": "2021년 2월 28일 오후 12시 ~ 오후 5시",
  "note": "",
  "links": {
    "problemBojLink": "https://www.acmicpc.net/category/detail/2446",
    "problemPdf": "SUAPC_2021w_Problem.pdf",
    "solutionPdf": "SUAPC_2021w_Solution.pdf",
    "scoreboard": ["https://www.acmicpc.net/contest/spotboard/586"],
    "posterImage": "SUAPC_2021w_Poster.png"
  },
  "contest": [
    {
      "contestName": null,
      "awards": [
        {
          "rank": 1,
          "solved": 12,
          "teamName": "Supported by LKY",
          "school": "연세대학교",
          "member": ["윤인섭", "황준호", "남현우"]
        },
        {
          "rank": 2,
          "solved": 9,
          "teamName": "151719",
          "school": "서강대학교",
          "member": ["전해성", "정재훈", "이준석"]
        },
        {
          "rank": 3,
          "solved": 9,
          "teamName": "NO ORANGE CANT WIN",
          "school": "서강대학교",
          "member": ["김관우", "박재형", "이윤제"]
        },
        {
          "rank": 4,
          "solved": 8,
          "teamName": "TERRA",
          "school": "서강대학교",
          "member": ["이동주", "이민희", "조원빈"]
        },
        {
          "rank": 5,
          "solved": 8,
          "teamName": "팬케이크맛 쿠키",
          "school": "연세대학교",
          "member": ["박선종", "김태윤", "김민재"]
        },
        {
          "rank": 6,
          "solved": 7,
          "teamName": "APP",
          "school": "서강대학교",
          "member": ["강문해", "강다혜", "전민수"]
        },
        {
          "rank": 7,
          "solved": 7,
          "teamName": "전생했더니 박건이었던 건에 대하여",
          "school": "서강대학교",
          "member": ["강효규", "박건", "손기령"]
        },
        {
          "rank": 8,
          "solved": 6,
          "teamName": "서수삼",
          "school": "서강대학교",
          "member": ["홍서준", "유호영", "오재석"]
        },
        {
          "rank": 9,
          "solved": 6,
          "teamName": "동동박",
          "school": "연세대학교",
          "member": ["권동욱", "동용훈", "박영한"]
        },
        {
          "rank": 10,
          "solved": 6,
          "teamName": "상금타서소고기사먹자",
          "school": "홍익대학교",
          "member": ["정윤석", "김종욱", "서영진"]
        }
      ],
      "problemList": [
        {
          "problemTitle": "우선순위 계산기",
          "link": "https://www.acmicpc.net/problem/20936",
          "setter": {
            "name": "이국렬",
            "school": "연세대학교",
            "bojHandle": "lky7674"
          }
        },
        {
          "problemTitle": "떡국",
          "link": "https://www.acmicpc.net/problem/20937",
          "setter": {
            "name": "이상원",
            "school": "서강대학교",
            "bojHandle": "gumgood"
          }
        },
        {
          "problemTitle": "반짝반짝",
          "link": "https://www.acmicpc.net/problem/20938",
          "setter": {
            "name": "박수현",
            "school": "서강대학교",
            "bojHandle": "shiftpsh"
          }
        },
        {
          "problemTitle": "달고나",
          "link": "https://www.acmicpc.net/problem/20939",
          "setter": {
            "name": "이상원",
            "school": "서강대학교",
            "bojHandle": "gumgood"
          }
        },
        {
          "problemTitle": "시철이가 사랑한 수식",
          "link": "https://www.acmicpc.net/problem/20940",
          "setter": {
            "name": "정기웅",
            "school": "연세대학교",
            "bojHandle": "QuqqU"
          }
        },
        {
          "problemTitle": "성싶당",
          "link": "https://www.acmicpc.net/problem/20941",
          "setter": {
            "name": "박수현",
            "school": "서강대학교",
            "bojHandle": "shiftpsh"
          }
        },
        {
          "problemTitle": "신촌지역 초중고등학생 프로그래밍 대회 동아리 연합 대회",
          "link": "https://www.acmicpc.net/problem/20942",
          "setter": {
            "name": "정연두",
            "school": "홍익대학교",
            "bojHandle": "Green55"
          }
        },
        {
          "problemTitle": "카카오톡",
          "link": "https://www.acmicpc.net/problem/20943",
          "setter": {
            "name": "이국렬",
            "school": "연세대학교",
            "bojHandle": "lky7674"
          }
        },
        {
          "problemTitle": "팰린드롬 척화비",
          "link": "https://www.acmicpc.net/problem/20944",
          "setter": {
            "name": "정기웅",
            "school": "연세대학교",
            "bojHandle": "QuqqU"
          }
        },
        {
          "problemTitle": "의자 게임",
          "link": "https://www.acmicpc.net/problem/20945",
          "setter": {
            "name": "정연두",
            "school": "홍익대학교",
            "bojHandle": "Green55"
          }
        },
        {
          "problemTitle": "합성인수분해",
          "link": "https://www.acmicpc.net/problem/20946",
          "setter": {
            "name": "정연두",
            "school": "홍익대학교",
            "bojHandle": "Green55"
          }
        },
        {
          "problemTitle": "습격받은 도시",
          "link": "https://www.acmicpc.net/problem/20947",
          "setter": {
            "name": "이상원",
            "school": "서강대학교",
            "bojHandle": "gumgood"
          }
        },
        {
          "problemTitle": "Go와 함께하는 전화망 서비스",
          "link": "https://www.acmicpc.net/problem/20948",
          "setter": {
            "name": "이국렬",
            "school": "연세대학교",
            "bojHandle": "lky7674"
          }
        }
      ]
    }
  ],
  "setter": [
    {
      "name": "이국렬",
      "school": "연세대학교",
      "bojHandle": "lky7674"
    },
    {
      "name": "정연두",
      "school": "홍익대학교",
      "bojHandle": "Green55"
    },
    {
      "name": "박수현",
      "school": "서강대학교",
      "bojHandle": "shiftpsh"
    },
    {
      "name": "정기웅",
      "school": "연세대학교",
      "bojHandle": "QuqqU"
    },
    {
      "name": "이상원",
      "school": "서강대학교",
      "bojHandle": "gumgood"
    }
  ],
  "reviewer": [
    {
      "name": "최재민",
      "school": "KAIST",
      "bojHandle": "jh05013"
    },
    {
      "name": "조경완",
      "school": "숭실대학교",
      "bojHandle": "chogahui05"
    },
    {
      "name": "남현욱",
      "school": "Team Samoyed",
      "bojHandle": "jwvg0425"
    },
    {
      "name": "권일우",
      "school": "인천대학교",
      "bojHandle": "rdd6584"
    }
  ],
  "sponsor": [
    {
      "id": "kakao",
      "name": "카카오"
    },
    {
      "id": "naver-d2",
      "name": "NAVER D2"
    },
    {
      "id": "mnsoft",
      "name": "현대엠엔소프트"
    },
    {
      "id": "jetbrains",
      "name": "JetBrains"
    },
    {
      "id": "hanbit",
      "name": "한빛미디어"
    },
    {
      "id": "jpub",
      "name": "제이펍"
    },
    {
      "id": "youngjin",
      "name": "영진닷컴"
    },
    {
      "id": "startlink",
      "name": "스타트링크"
    }
  ]
}
