{
  "$schema": "./schema.json",
  "year": 2024,
  "season": "Summer",
  "dateTime": "2024년 8월 25일(토) 오후 12시 ~ 오후 5시",
  "note": "",
  "links": {
    "problemBojLink": "https://www.acmicpc.net/category/detail/4276",
    "solutionPdf": "https://upload.acmicpc.net/d8445ed9-91a0-4df4-b88a-60898c519005/",
    "scoreboard": ["https://www.acmicpc.net/contest/spotboard/1319"],
    "posterImage": "https://drive.google.com/file/d/15TrDAYAf9_jf2ivglRIDzxN6GOPrItpM/view?usp=drive_link"
  },
  "contest": [
    {
      "contestName": null,
      "awards": [
        {
          "rank": 1,
          "solved": 12,
          "teamName": "PS:Endgame",
          "school": "연세대학교",
          "member": ["정용진", "김형진", "김태윤"]
        },
        {
          "rank": 2,
          "solved": 12,
          "teamName": "Redshift",
          "school": "서강대학교",
          "member": ["박수현", "조원빈", "채성우"]
        },
        {
          "rank": 3,
          "solved": 10,
          "teamName": "탈PS는지능순",
          "school": "연세대학교",
          "member": ["이명헌", "곽재혁", "김민준"]
        },
        {
          "rank": 4,
          "solved": 10,
          "teamName": "3인분같은2인분",
          "school": "연세대학교",
          "member": ["김건우", "김지호", "장현우"]
        },
        {
          "rank": 5,
          "solved": 9,
          "teamName": "ALL_TIME_LEGEND",
          "school": "서강대학교",
          "member": ["이승형", "박성준", "송근수"]
        },
        {
          "rank": 6,
          "solved": 9,
          "teamName": "goraani never stop",
          "school": "서강대학교",
          "member": ["강효규", "김동건", "유호영"]
        },
        {
          "rank": 7,
          "solved": 7,
          "teamName": "김재현",
          "school": "홍익대학교",
          "member": ["정재현", "김도현", "김재헌"]
        },
        {
          "rank": 8,
          "solved": 7,
          "teamName": ".",
          "school": "연세대학교",
          "member": ["이협", "이도훈", "최우현"]
        },
        {
          "rank": 9,
          "solved": 6,
          "teamName": "I2C",
          "school": "서강대학교",
          "member": ["김진수", "박준성", "하건영"]
        },
        {
          "rank": 10,
          "solved": 6,
          "teamName": "팀 이름",
          "school": "서강대학교",
          "member": ["조성훈", "손기령", "정회윤"]
        }
      ],
      "problemList": [
        {
          "problemTitle": "SWAPC",
          "link": "https://www.acmicpc.net/problem/32158",
          "setter": {
            "name": "이지언",
            "school": "연세대학교",
            "bojHandle": "ez_code"
          }
        },
        {
          "problemTitle": "평균 구하기",
          "link": "https://www.acmicpc.net/problem/32159",
          "setter": {
            "name": "박상수",
            "school": "Samsung Research",
            "bojHandle": "cki86201"
          }
        },
        {
          "problemTitle": "숫자 놀이",
          "link": "https://www.acmicpc.net/problem/32160",
          "setter": {
            "name": "곽우석",
            "school": "SK하이닉스",
            "bojHandle": "bubbler"
          }
        },
        {
          "problemTitle": "축지법",
          "link": "https://www.acmicpc.net/problem/32161",
          "setter": {
            "name": "전우제",
            "school": "연세대학교",
            "bojHandle": "kiwiyou"
          }
        },
        {
          "problemTitle": "n, 3n, 5n",
          "link": "https://www.acmicpc.net/problem/32162",
          "setter": {
            "name": "곽우석",
            "school": "SK하이닉스",
            "bojHandle": "bubbler"
          }
        },
        {
          "problemTitle": "사탕 배달",
          "link": "https://www.acmicpc.net/problem/32163",
          "setter": {
            "name": "정치훈",
            "school": "Samsung Research",
            "bojHandle": "wjdclgns12"
          }
        },
        {
          "problemTitle": "지워진 ETT",
          "link": "https://www.acmicpc.net/problem/32164",
          "setter": {
            "name": "김도훈",
            "school": "한양대학교",
            "bojHandle": "dohoon"
          }
        },
        {
          "problemTitle": "잊음을 논함",
          "link": "https://www.acmicpc.net/problem/32165",
          "setter": {
            "name": "노현제",
            "school": "서울과학기술대학교",
            "bojHandle": "hjroh0315"
          }
        },
        {
          "problemTitle": "시험 주행",
          "link": "https://www.acmicpc.net/problem/32166",
          "setter": {
            "name": "김영현",
            "school": "서울대학교",
            "bojHandle": "kipa00"
          }
        },
        {
          "problemTitle": "a11y",
          "link": "https://www.acmicpc.net/problem/32167",
          "setter": {
            "name": "박상수",
            "school": "Samsung Research",
            "bojHandle": "cki86201"
          }
        },
        {
          "problemTitle": "완전 이진 트리와 쿼리",
          "link": "https://www.acmicpc.net/problem/32168",
          "setter": {
            "name": "정치훈",
            "school": "Samsung Research",
            "bojHandle": "wjdclgns12"
          }
        },
        {
          "problemTitle": "허술한 보안 프로그램",
          "link": "https://www.acmicpc.net/problem/32169",
          "setter": {
            "name": "서종환",
            "school": "서울대학교",
            "bojHandle": "mujigae"
          }
        },
        {
          "problemTitle": "나무 키우기",
          "link": "https://www.acmicpc.net/problem/32170",
          "setter": {
            "name": "박상수",
            "school": "Samsung Research",
            "bojHandle": "cki86201"
          }
        }
      ]
    }
  ],
  "setter": [
    {
      "name": "이지언",
      "school": "연세대학교",
      "bojHandle": "ez_code"
    },
    {
      "name": "박상수",
      "school": "Samsung Research",
      "bojHandle": "cki86201"
    },
    {
      "name": "곽우석",
      "school": "SK하이닉스",
      "bojHandle": "bubbler"
    },
    {
      "name": "전우제",
      "school": "연세대학교",
      "bojHandle": "kiwiyou"
    },
    {
      "name": "정치훈",
      "school": "Samsung Research",
      "bojHandle": "wjdclgns12"
    },
    {
      "name": "김도훈",
      "school": "한양대학교",
      "bojHandle": "dohoon"
    },
    {
      "name": "김영현",
      "school": "서울대학교",
      "bojHandle": "kipa00"
    },
    {
      "name": "서종환",
      "school": "서울대학교",
      "bojHandle": "mujigae"
    },
    {
      "name": "노현제",
      "school": "서울과학기술대학교",
      "bojHandle": "hjroh0315"
    }
  ],
  "reviewer": [
    {
      "name": "김동현",
      "school": "Moloco",
      "bojHandle": "kdh9949"
    },
    {
      "name": "임병찬",
      "school": "POSTECH",
      "bojHandle": "hyperbolic"
    },
    {
      "name": "장래오",
      "school": "POSTECH",
      "bojHandle": "leo020630"
    },
    {
      "name": "박종경",
      "school": "서울대학교",
      "bojHandle": "jk410"
    },
    {
      "name": "이국렬",
      "school": "연세대학교",
      "bojHandle": "lky7674"
    }
  ],
  "sponsor": [
    {
      "id": "solvedac",
      "name": "솔브드"
    },
    {
      "id": "startlink",
      "name": "스타트링크"
    },
    {
      "id": "autoever",
      "name": "현대오토에버"
    },
    {
      "id": "cubrid",
      "name": "큐브리드"
    },
    {
      "id": "codeit",
      "name": "코드잇"
    },
    {
      "id": "insight",
      "name": "인사이트"
    },
    {
      "id": "goldenrabbit",
      "name": "골든래빗"
    },
    {
      "id": "jpub",
      "name": "제이펍"
    }
  ],
  "personalSponsor": [
    {
      "id": "cubic",
      "name": "cubic"
    },
    {
      "id": "pjshwa",
      "name": "pjshwa"
    },
    {
      "id": "kokokokojima",
      "name": "kokokokojima"
    },
    {
      "id": "신정화",
      "name": "신정화"
    },
    {
      "id": "이지언",
      "name": "이지언"
    }
  ]
}
