{
  "$schema": "./schema.json",
  "year": 2021,
  "season": "Summer",
  "dateTime": "2021년 8월 28일 오후 12시 ~ 오후 5시",
  "note": "",
  "links": {
    "problemBojLink": "https://www.acmicpc.net/category/detail/2757",
    "problemPdf": "SUAPC_2021s_Problem.pdf",
    "solutionPdf": "SUAPC_2021s_Solution.pdf",
    "scoreboard": ["https://www.acmicpc.net/contest/spotboard/678"],
    "posterImage": "SUAPC_2021s_Poster.png"
  },
  "contest": [
    {
      "contestName": null,
      "awards": [
        {
          "rank": 1,
          "solved": 8,
          "teamName": "또또 나만 모르는 웰노운 낸다",
          "school": "서강대학교",
          "member": ["강효규", "이상원", "조원빈"]
        },
        {
          "rank": 2,
          "solved": 8,
          "teamName": "스파르타Rebro클럽",
          "school": "서강대학교",
          "member": ["박재형", "오재석", "진상우"]
        },
        {
          "rank": 3,
          "solved": 8,
          "teamName": "Order of One",
          "school": "연세대학교",
          "member": ["김기현", "김종민", "정호용"]
        },
        {
          "rank": 4,
          "solved": 8,
          "teamName": "투머치코더",
          "school": "연세대학교",
          "member": ["김형진", "동용훈", "이승재"]
        },
        {
          "rank": 5,
          "solved": 7,
          "teamName": "생수",
          "school": "홍익대학교",
          "member": ["김기선", "김효원", "정재현"]
        },
        {
          "rank": 6,
          "solved": 6,
          "teamName": "우승못하면2학기휴학함",
          "school": "홍익대학교",
          "member": ["권찬", "김도현", "박건휘"]
        },
        {
          "rank": 7,
          "solved": 5,
          "teamName": "상금 못 받으면 회식 못해요 ㅠㅠ",
          "school": "서강대학교",
          "member": ["김정모", "김준우", "박준서"]
        },
        {
          "rank": 8,
          "solved": 5,
          "teamName": "philmath12",
          "school": "서강대학교",
          "member": ["김민형", "이호현", "한상필"]
        },
        {
          "rank": 9,
          "solved": 5,
          "teamName": "ECM",
          "school": "서강대학교",
          "member": ["권지은", "김성현", "김창민"]
        },
        {
          "rank": 10,
          "solved": 5,
          "teamName": "재국이와 아이둘",
          "school": "서강대학교",
          "member": ["조유화", "조재국", "한덕규"]
        }
      ],
      "problemList": [
        {
          "problemTitle": "휴먼 파이프라인",
          "link": "https://www.acmicpc.net/problem/22981",
          "setter": {
            "name": "전해성",
            "school": "서강대학교",
            "bojHandle": "seastar105"
          }
        },
        {
          "problemTitle": "선인장의 독립집합",
          "link": "https://www.acmicpc.net/problem/22982",
          "setter": {
            "name": "이국렬",
            "school": "연세대학교",
            "bojHandle": "lky7674"
          }
        },
        {
          "problemTitle": "조각 체스판",
          "link": "https://www.acmicpc.net/problem/22983",
          "setter": {
            "name": "박수현",
            "school": "서강대학교",
            "bojHandle": "shiftpsh"
          }
        },
        {
          "problemTitle": "반짝반짝 2",
          "link": "https://www.acmicpc.net/problem/22984",
          "setter": {
            "name": "이국렬",
            "school": "연세대학교",
            "bojHandle": "lky7674"
          }
        },
        {
          "problemTitle": "문자열 조작의 달인",
          "link": "https://www.acmicpc.net/problem/22985",
          "setter": {
            "name": "김규진",
            "school": "서강대학교",
            "bojHandle": "snrnsidy"
          }
        },
        {
          "problemTitle": "Flat Earth",
          "link": "https://www.acmicpc.net/problem/22986",
          "setter": {
            "name": "전해성",
            "school": "서강대학교",
            "bojHandle": "seastar105"
          }
        },
        {
          "problemTitle": "기지국 업그레이드",
          "link": "https://www.acmicpc.net/problem/22987",
          "setter": {
            "name": "이혜아",
            "school": "KAIST",
            "bojHandle": "ho94949"
          }
        },
        {
          "problemTitle": "재활용 캠페인",
          "link": "https://www.acmicpc.net/problem/22988",
          "setter": {
            "name": "이혜아",
            "school": "KAIST",
            "bojHandle": "ho94949"
          }
        },
        {
          "problemTitle": "브런치북",
          "link": "https://www.acmicpc.net/problem/22989",
          "setter": {
            "name": "이혜아",
            "school": "KAIST",
            "bojHandle": "ho94949"
          }
        },
        {
          "problemTitle": "사이클",
          "link": "https://www.acmicpc.net/problem/22990",
          "setter": {
            "name": "이국렬",
            "school": "연세대학교",
            "bojHandle": "lky7674"
          }
        },
        {
          "problemTitle": "수요응답형 버스",
          "link": "https://www.acmicpc.net/problem/22991",
          "setter": {
            "name": "김규진",
            "school": "서강대학교",
            "bojHandle": "snrnsidy"
          }
        },
        {
          "problemTitle": "다꾸",
          "link": "https://www.acmicpc.net/problem/22992",
          "setter": {
            "name": "박수현",
            "school": "서강대학교",
            "bojHandle": "shiftpsh"
          }
        }
      ]
    }
  ],
  "setter": [
    {
      "name": "김규진",
      "school": "서강대학교",
      "bojHandle": "snrnsidy"
    },
    {
      "name": "박수현",
      "school": "서강대학교",
      "bojHandle": "shiftpsh"
    },
    {
      "name": "이국렬",
      "school": "연세대학교",
      "bojHandle": "lky7674"
    },
    {
      "name": "이혜아",
      "school": "KAIST",
      "bojHandle": "ho94949"
    },
    {
      "name": "전해성",
      "school": "서강대학교",
      "bojHandle": "seastar105"
    }
  ],
  "reviewer": [
    {
      "name": "김채완",
      "school": "선린인터넷고등학교",
      "bojHandle": "amsminn"
    },
    {
      "name": "김태영",
      "school": "KAIST",
      "bojHandle": "tae826"
    },
    {
      "name": "정치훈",
      "school": "인하대학교",
      "bojHandle": "wjdclgns12"
    },
    {
      "name": "정현서",
      "school": "서울대학교",
      "bojHandle": "jhwest2"
    },
    {
      "name": "홍은기",
      "school": "삼성전자",
      "bojHandle": "pichulia"
    }
  ],
  "sponsor": [
    {
      "id": "kakao",
      "name": "카카오"
    },
    {
      "id": "autoever",
      "name": "현대오토에버"
    },
    {
      "id": "naver-d2",
      "name": "NAVER D2"
    },
    {
      "id": "furiosa",
      "name": "퓨리오사"
    },
    {
      "id": "hanbit",
      "name": "한빛미디어"
    },
    {
      "id": "youngjin",
      "name": "영진닷컴"
    },
    {
      "id": "easyspub",
      "name": "이지스퍼블리싱"
    },
    {
      "id": "startlink",
      "name": "스타트링크"
    },
    {
      "id": "solvedac",
      "name": "솔브드"
    }
  ]
}
